<?xml version="1.0" encoding="UTF-8"?>
<!-- COPYRIGHT DASSAULT SYSTEMES 2002 -->
<!-- 02:06:01 creation -->
<!DOCTYPE ImagesList SYSTEM "ImageDefinition.dtd">
<?xml-stylesheet type="text/xsl" href="ImageDefinition.xsl"?>

<ImagesList Name="GPS Toolbar Images">

<!-- ************** ELEMENTS : 9 ****************** -->

<Image Name="Mesh" Physical="ELEMENTS" Visu="MESH" >
  <Criterion Name="MESH" >
    <Values>
      <Position Name="ELEMENT"/>
      <MathType Name="SCALAR"/>
    </Values>
  </Criterion>
</Image>

<Image Name="Mesh_Deformed" Physical="ELEMENTS" Visu="MESH" >
  <Criterion Name="DEFORMED-MESH" >
    <Values>
      <Position Name="ELEMENT"/>
      <MathType Name="SCALAR"/>
    </Values>
  </Criterion>
  <Attributes><Display Deformed="YES"/></Attributes>
</Image>

<!-- ************** STRESS : 148 ****************** -->

<Image Name="Stress_Iso_PpalShearing_Disc" Physical="STRESS" Visu="DISCONTINUOUS-ISO" Hidden="YES">
  <Criterion Name="PRINCIPAL-SHEARING" >
    <Values>
      <Position Name="NODE_OF_ELEMENT"/>
      <MathType Name="EIGEN_VALUES"/>
      <MathDim Name="2D"/><MathDim Name="3D"/>
      <Filters>
        <Smi Name="UPPER"/>
      </Filters>
    </Values>
    <ProcessList><Process Name="SPMProcessPrincipalShearing"/></ProcessList>
  </Criterion>
  <Attributes><Display Deformed="YES"/></Attributes>
</Image>

<Image Name="Stress_Iso_PpalValue_Disc" Physical="STRESS" Visu="DISCONTINUOUS-ISO" >
  <Criterion Name="PRINCIPAL-VALUE" >
    <Values>
      <Position Name="NODE_OF_ELEMENT"/>
      <MathType Name="EIGEN_VALUES"/>
      <Filters>
        <Smi Name="UPPER"/>
        <Component Name="C1"/>
      </Filters>
    </Values>
  </Criterion>
  <Attributes><Display Deformed="YES"/></Attributes>
</Image>

<Image Name="Stress_Symbol_PpalTensor" Physical="STRESS" Visu="SYMBOL" >
  <Criterion Name="PRINCIPAL-VALUE" >
    <Values>
      <DefaultPosition Name="NODE"/>
      <Position Name="CENTER"/>
      <Position Name="NODE_OF_ELEMENT"/>
      <Position Name="GAUSS"/>
      <MathType Name="EIGEN_VALUES"/>
      <Filters>
        <Smi Name="UPPER"/>
      </Filters>
    </Values>
  </Criterion>
  <Attributes><Display Deformed="YES"/></Attributes>
</Image>

<!-- ************** TRANSLATION : 127 ****************** -->

<Image Name="Disp_Iso" Physical="TRANSLATION" Visu="AVERAGE-ISO" >
  <Criterion Name="NORMALIZE" >
    <Values>
      <Position Name="NODE"/>
      <MathType Name="VECTOR"/>
    </Values>
    <ProcessList><Process Name="SPMProcessNormalize"/></ProcessList>
  </Criterion>
  <Attributes><Display Deformed="YES"/></Attributes>
</Image>

<Image Name="Disp_Iso_Component" Physical="TRANSLATION" Visu="AVERAGE-ISO" >
  <Criterion Name="VECTOR_COMPONENT" >
    <Values>
      <Position Name="NODE"/>
      <MathType Name="VECTOR"/>
      <Filters>
        <Component Name="C1"/>
      </Filters>
    </Values>
  </Criterion>
  <Attributes><Display Deformed="YES"/></Attributes>
</Image>

<Image Name="Disp_Symbol" Physical="TRANSLATION" Visu="SYMBOL" >
  <Criterion Name="VECTOR" >
    <Values>
      <Position Name="NODE"/>
      <MathType Name="VECTOR"/>
    </Values>
  </Criterion>
  <Attributes><Display Deformed="YES"/></Attributes>
</Image>

<ImageByReference Name="Relative_Disp_Symbol" Reference="Disp_Symbol" SubType="RELATIVE" />


<!-- ************** STRESS_VON_MISES : 149 ****************** -->

<Image Name="StressVonMises_Iso_Smooth" Physical="STRESS_VON_MISES" Visu="AVERAGE-ISO" >
  <Criterion Name="SCALAR" >
    <Values>
      <Position Name="NODE"/>
      <MathType Name="SCALAR"/>
      <Filters>
        <Smi Name="UPPER"/>
      </Filters>
    </Values>
  </Criterion>
  <Attributes>
    <Display Deformed="YES" />
    <ColorMap Smooth="YES" />
  </Attributes>
</Image>

<!-- ************** ESTIMATED_ERROR : 154 ****************** -->

<Image Name="EstimatedError_Fringe" Physical="ESTIMATED_ERROR" Visu="FRINGE" >
  <Criterion Name="LOCAL-ERROR" >
    <Values>
      <Position Name="CENTER"/>
      <MathType Name="SCALAR"/>
    </Values>
  </Criterion>
  <Attributes><ColorMap MinMaxMode="ALL"/></Attributes>
</Image>

<!-- ************** TEMPERATURE : 155 ****************** -->

<Image Name="Temperature_Field_Fringe" Physical="TEMPERATURE" Visu="FRINGE" >
  <Criterion Name="SCALAR" >
    <Values>
      <Position Name="ELEMENT"/>
      <MathType Name="SCALAR"/>
    </Values>
  </Criterion>
</Image>

<Image Name="Temperature_Field_Text" Physical="TEMPERATURE" Visu="TEXT" Hidden="YES" >
  <Criterion Name="SCALAR" >
    <Values>
      <Position Name="ELEMENT"/>
      <MathType Name="SCALAR"/>
    </Values>
  </Criterion>
</Image>

<Image Name="Temperature_Field_Iso" Physical="TEMPERATURE" Visu="AVERAGE-ISO" Hidden="YES" >
  <Criterion Name="SCALAR" >
    <Values>
      <Position Name="NODE"/>
      <MathType Name="SCALAR"/>
    </Values>
  </Criterion>
</Image>

</ImagesList>
